{
  "numero": "INT-2026-0041",
  "client": "c-0611",
  "techniciens": [
    "kevin.lambert"
  ],
  "debut": "2026-11-23T08:00:00+01:00",
  "fin": "2026-11-23T09:30:00+01:00",
  "nature": "visite_annuelle",
  "objet": "Visite annuelle du contrat Sérénité",
  "statut": "planifiee",
  "cree_par": "marc.duval"
}
