{
  "numero": "INT-2026-0051",
  "client": "c-0228",
  "techniciens": [
    "enzo.caron"
  ],
  "debut": "2026-12-04T08:00:00+01:00",
  "fin": "2026-12-04T09:00:00+01:00",
  "nature": "depannage",
  "objet": "Contrôle de la chaudière gaz posée le 30 novembre",
  "statut": "planifiee",
  "cree_par": "marc.duval"
}
